{
  "id": "U13-RESTAMP",
  "priority": 112,
  "family": "queue",
  "class": "review-rerequest",
  "cites": [
    "G12",
    "G21"
  ],
  "match": {
    "kind": "pr-verdict-old-head",
    "all": [
      ".old_verdict | test(\"^MERGE\")",
      ".lead_request_open == false",
      "(.idle_min | type) == \"number\" and .idle_min >= .restamp_idle_min"
    ]
  },
  "judge": null,
  "action": {
    "name": "lead_rerequest",
    "args": {
      "request_id": ".request_id",
      "priority": ".priority"
    }
  },
  "key": [
    "repo",
    "pr",
    "head",
    "id"
  ],
  "note": "BH-8390. A MERGE or MERGE-WITH-NOTES stands on an older head after a restamp or a main merge, nothing stands on the new head, and no lead request is open for it for restamp_idle_min (UNBLOCK_RESTAMP_IDLE_MIN): ask the lead for the new head (request_id none: no reset). Hand fixes 2026-10-21..26 (#7767 #8014 #8136)."
}
